[
  {
    "player_id": "1630173",
    "value_score": 25,
    "risk_score": 28,
    "opportunity_index": 35,
    "notes": "Low value, volatile, durable"
  },
  {
    "player_id": "203500",
    "value_score": 29,
    "risk_score": 29,
    "opportunity_index": 34,
    "notes": "Low value, volatile, durable"
  },
  {
    "player_id": "1628389",
    "value_score": 66,
    "risk_score": 22,
    "opportunity_index": 34,
    "notes": "Strong value, durable"
  },
  {
    "player_id": "1630534",
    "value_score": 18,
    "risk_score": 22,
    "opportunity_index": 36,
    "notes": "Low value, volatile, durable"
  },
  {
    "player_id": "1630583",
    "value_score": 33,
    "risk_score": 22,
    "opportunity_index": 36,
    "notes": "Low value, volatile, durable"
  },
  {
    "player_id": "1629638",
    "value_score": 26,
    "risk_score": 20,
    "opportunity_index": 36,
    "notes": "Low value, durable"
  },
  {
    "player_id": "1628960",
    "value_score": 34,
    "risk_score": 20,
    "opportunity_index": 35,
    "notes": "Low value, durable"
  },
  {
    "player_id": "1628386",
    "value_score": 56,
    "risk_score": 23,
    "opportunity_index": 34,
    "notes": "Moderate value, durable"
  },
  {
    "player_id": "1630631",
    "value_score": 26,
    "risk_score": 34,
    "opportunity_index": 33,
    "notes": "Low value, volatile"
  },
  {
    "player_id": "203937",
    "value_score": 16,
    "risk_score": 31,
    "opportunity_index": 34,
    "notes": "Low value, volatile"
  },
  {
    "player_id": "203507",
    "value_score": 82,
    "risk_score": 29,
    "opportunity_index": 33,
    "notes": "Elite value, durable"
  },
  {
    "player_id": "203648",
    "value_score": 0,
    "risk_score": 38,
    "opportunity_index": 33,
    "notes": "Low value, volatile"
  },
  {
    "player_id": "1630175",
    "value_score": 39,
    "risk_score": 24,
    "opportunity_index": 36,
    "notes": "Low value, durable"
  },
  {
    "player_id": "1628384",
    "value_score": 38,
    "risk_score": 38,
    "opportunity_index": 31,
    "notes": "Low value, volatile"
  },
  {
    "player_id": "1630166",
    "value_score": 49,
    "risk_score": 24,
    "opportunity_index": 33,
    "notes": "Moderate value, durable"
  },
  {
    "player_id": "1629028",
    "value_score": 50,
    "risk_score": 23,
    "opportunity_index": 34,
    "notes": "Moderate value, volatile, durable"
  },
  {
    "player_id": "1628963",
    "value_score": 10,
    "risk_score": 37,
    "opportunity_index": 35,
    "notes": "Low value, volatile"
  },
  {
    "player_id": "1630163",
    "value_score": 60,
    "risk_score": 28,
    "opportunity_index": 34,
    "notes": "Strong value, volatile, durable"
  },
  {
    "player_id": "1628366",
    "value_score": 40,
    "risk_score": 36,
    "opportunity_index": 32,
    "notes": "Moderate value, volatile"
  },
  {
    "player_id": "1631094",
    "value_score": 51,
    "risk_score": 38,
    "opportunity_index": 32,
    "notes": "Moderate value, volatile"
  },
  {
    "player_id": "1630217",
    "value_score": 55,
    "risk_score": 34,
    "opportunity_index": 33,
    "notes": "Moderate value"
  },
  {
    "player_id": "1631230",
    "value_score": 0,
    "risk_score": 30,
    "opportunity_index": 36,
    "notes": "Low value, volatile, durable"
  },
  {
    "player_id": "203084",
    "value_score": 36,
    "risk_score": 37,
    "opportunity_index": 32,
    "notes": "Low value, high consistency"
  },
  {
    "player_id": "1630567",
    "value_score": 63,
    "risk_score": 28,
    "opportunity_index": 33,
    "notes": "Strong value, durable"
  },
  {
    "player_id": "1629628",
    "value_score": 44,
    "risk_score": 37,
    "opportunity_index": 32,
    "notes": "Moderate value, volatile"
  },
  {
    "player_id": "1629646",
    "value_score": 4,
    "risk_score": 24,
    "opportunity_index": 37,
    "notes": "Low value, volatile, durable"
  },
  {
    "player_id": "1642419",
    "value_score": 0,
    "risk_score": 39,
    "opportunity_index": 34,
    "notes": "Low value, volatile"
  },
  {
    "player_id": "201587",
    "value_score": 9,
    "risk_score": 24,
    "opportunity_index": 36,
    "notes": "Low value, volatile, durable"
  },
  {
    "player_id": "203078",
    "value_score": 37,
    "risk_score": 35,
    "opportunity_index": 32,
    "notes": "Low value, volatile"
  },
  {
    "player_id": "1630180",
    "value_score": 35,
    "risk_score": 25,
    "opportunity_index": 34,
    "notes": "Low value, volatile, durable"
  },
  {
    "player_id": "1629048",
    "value_score": 22,
    "risk_score": 27,
    "opportunity_index": 36,
    "notes": "Low value, volatile, durable"
  },
  {
    "player_id": "202687",
    "value_score": 0,
    "risk_score": 23,
    "opportunity_index": 37,
    "notes": "Low value, volatile, durable"
  },
  {
    "player_id": "1641710",
    "value_score": 12,
    "risk_score": 29,
    "opportunity_index": 36,
    "notes": "Low value, volatile, durable"
  },
  {
    "player_id": "203992",
    "value_score": 20,
    "risk_score": 29,
    "opportunity_index": 35,
    "notes": "Low value, volatile, durable"
  },
  {
    "player_id": "1641737",
    "value_score": 0,
    "risk_score": 36,
    "opportunity_index": 35,
    "notes": "Low value, volatile"
  },
  {
    "player_id": "1626164",
    "value_score": 69,
    "risk_score": 25,
    "opportunity_index": 31,
    "notes": "Strong value, durable"
  },
  {
    "player_id": "1628449",
    "value_score": 22,
    "risk_score": 28,
    "opportunity_index": 34,
    "notes": "Low value, durable"
  },
  {
    "player_id": "1628396",
    "value_score": 3,
    "risk_score": 32,
    "opportunity_index": 36,
    "notes": "Low value, volatile"
  },
  {
    "player_id": "1631103",
    "value_score": 10,
    "risk_score": 34,
    "opportunity_index": 34,
    "notes": "Low value, volatile"
  },
  {
    "player_id": "1631128",
    "value_score": 26,
    "risk_score": 35,
    "opportunity_index": 34,
    "notes": "Low value, volatile"
  },
  {
    "player_id": "1628969",
    "value_score": 54,
    "risk_score": 34,
    "opportunity_index": 30,
    "notes": "Moderate value"
  },
  {
    "player_id": "1628970",
    "value_score": 58,
    "risk_score": 35,
    "opportunity_index": 31,
    "notes": "Moderate value"
  },
  {
    "player_id": "1628415",
    "value_score": 37,
    "risk_score": 22,
    "opportunity_index": 34,
    "notes": "Low value, durable"
  },
  {
    "player_id": "1628971",
    "value_score": 20,
    "risk_score": 20,
    "opportunity_index": 38,
    "notes": "Low value, volatile, durable"
  },
  {
    "player_id": "1627759",
    "value_score": 64,
    "risk_score": 25,
    "opportunity_index": 34,
    "notes": "Strong value, durable"
  },
  {
    "player_id": "1641738",
    "value_score": 0,
    "risk_score": 26,
    "opportunity_index": 37,
    "notes": "Low value, volatile, durable"
  },
  {
    "player_id": "1628973",
    "value_score": 65,
    "risk_score": 22,
    "opportunity_index": 34,
    "notes": "Strong value, durable"
  },
  {
    "player_id": "1628418",
    "value_score": 11,
    "risk_score": 39,
    "opportunity_index": 34,
    "notes": "Low value, volatile"
  },
  {
    "player_id": "202710",
    "value_score": 32,
    "risk_score": 26,
    "opportunity_index": 36,
    "notes": "Low value, volatile, durable"
  },
  {
    "player_id": "1641824",
    "value_score": 8,
    "risk_score": 20,
    "opportunity_index": 37,
    "notes": "Low value, volatile, durable"
  },
  {
    "player_id": "1631288",
    "value_score": 0,
    "risk_score": 39,
    "opportunity_index": 34,
    "notes": "Low value, volatile"
  },
  {
    "player_id": "203484",
    "value_score": 32,
    "risk_score": 27,
    "opportunity_index": 33,
    "notes": "Low value, durable"
  },
  {
    "player_id": "1641739",
    "value_score": 25,
    "risk_score": 28,
    "opportunity_index": 35,
    "notes": "Low value, volatile, durable"
  },
  {
    "player_id": "203991",
    "value_score": 42,
    "risk_score": 28,
    "opportunity_index": 34,
    "notes": "Moderate value, durable"
  },
  {
    "player_id": "1642267",
    "value_score": 10,
    "risk_score": 35,
    "opportunity_index": 36,
    "notes": "Low value, volatile"
  },
  {
    "player_id": "1628975",
    "value_score": 15,
    "risk_score": 31,
    "opportunity_index": 33,
    "notes": "Low value"
  },
  {
    "player_id": "1628976",
    "value_score": 42,
    "risk_score": 37,
    "opportunity_index": 33,
    "notes": "Moderate value"
  },
  {
    "player_id": "1627936",
    "value_score": 27,
    "risk_score": 20,
    "opportunity_index": 36,
    "notes": "Low value, volatile, durable"
  },
  {
    "player_id": "1642264",
    "value_score": 21,
    "risk_score": 25,
    "opportunity_index": 38,
    "notes": "Low value, volatile, durable"
  },
  {
    "player_id": "1630658",
    "value_score": 0,
    "risk_score": 36,
    "opportunity_index": 36,
    "notes": "Low value, volatile"
  },
  {
    "player_id": "1630577",
    "value_score": 21,
    "risk_score": 39,
    "opportunity_index": 33,
    "notes": "Low value, volatile"
  },
  {
    "player_id": "1630551",
    "value_score": 10,
    "risk_score": 21,
    "opportunity_index": 38,
    "notes": "Low value, volatile, durable"
  },
  {
    "player_id": "1631108",
    "value_score": 19,
    "risk_score": 36,
    "opportunity_index": 34,
    "notes": "Low value, volatile"
  },
  {
    "player_id": "1631321",
    "value_score": 0,
    "risk_score": 24,
    "opportunity_index": 36,
    "notes": "Low value, volatile, durable"
  },
  {
    "player_id": "1641740",
    "value_score": 0,
    "risk_score": 36,
    "opportunity_index": 35,
    "notes": "Low value, volatile"
  },
  {
    "player_id": "1629634",
    "value_score": 31,
    "risk_score": 35,
    "opportunity_index": 33,
    "notes": "Low value, volatile"
  },
  {
    "player_id": "203903",
    "value_score": 31,
    "risk_score": 23,
    "opportunity_index": 35,
    "notes": "Low value, volatile, durable"
  },
  {